{
  "schema_version": "party_state.v0",
  "case_id": "D-B07",
  "session_id": "D-B07-S04",
  "source": "lm_runtime",
  "turns_contributing": [
    1,
    3,
    5
  ],
  "last_updated_turn": 5,
  "generated_at": "2026-03-28T16:30:32Z",
  "party_a": {
    "party_id": "party_a",
    "current_emotional_state": "mildly frustrated but controlled \u2014 concern is procedural, not personal",
    "emotional_arc": [
      {
        "turn_index": 1,
        "assessment": "unknown_baseline",
        "confidence": "low"
      },
      {
        "turn_index": 3,
        "assessment": "mildly frustrated but controlled \u2014 expressing a legitimate procedural grievance without hostility",
        "confidence": "moderate"
      },
      {
        "turn_index": 5,
        "assessment": "mildly frustrated but controlled \u2014 concern is procedural, not personal",
        "confidence": "moderate"
      }
    ],
    "accumulated_interests": [
      {
        "interest": "predictability and advance notice in financial obligations",
        "first_seen_turn": 3,
        "last_seen_turn": 3,
        "confidence": "moderate"
      },
      {
        "interest": "transparency and documentation in expense sharing",
        "first_seen_turn": 3,
        "last_seen_turn": 3,
        "confidence": "moderate"
      },
      {
        "interest": "feeling respected in co-parenting coordination",
        "first_seen_turn": 3,
        "last_seen_turn": 3,
        "confidence": "moderate"
      },
      {
        "interest": "avoiding surprise financial demands",
        "first_seen_turn": 3,
        "last_seen_turn": 5,
        "confidence": "moderate"
      },
      {
        "interest": "predictability in financial planning",
        "first_seen_turn": 5,
        "last_seen_turn": 5,
        "confidence": "moderate"
      },
      {
        "interest": "advance notice before payment requests",
        "first_seen_turn": 5,
        "last_seen_turn": 5,
        "confidence": "moderate"
      },
      {
        "interest": "documentation to validate expense legitimacy",
        "first_seen_turn": 5,
        "last_seen_turn": 5,
        "confidence": "moderate"
      },
      {
        "interest": "feeling respected in coordination process",
        "first_seen_turn": 5,
        "last_seen_turn": 5,
        "confidence": "moderate"
      }
    ],
    "risk_signal_history": [],
    "relational_posture_progression": [
      {
        "turn_index": 1,
        "posture": "not_yet_observable"
      },
      {
        "turn_index": 3,
        "posture": "assertive and procedurally focused \u2014 raising a concern directly but not attacking Party B personally"
      },
      {
        "turn_index": 5,
        "posture": "assertive and procedurally focused \u2014 articulating specific concerns without attacking Party B"
      }
    ],
    "scaffold_divergence_log": [
      {
        "turn_index": 1,
        "field": "relational_dynamic",
        "scaffold_value": "cooperative_and_stable",
        "model_value": "session_has_not_begun"
      },
      {
        "turn_index": 3,
        "field": "relational_dynamic",
        "scaffold_value": "cooperative_and_stable",
        "model_value": "asymmetric disclosure \u2014 Party A has staked out a position on process; Party B's response will reveal whether this is a shared concern, a contested issue, or a misunderstanding. No escalation signals yet, but the frame is complaint-oriented rather than interest-oriented."
      },
      {
        "turn_index": 5,
        "field": "relational_dynamic",
        "scaffold_value": "cooperative_and_stable",
        "model_value": "constructive tension \u2014 both parties have articulated legitimate process interests that are in tension but not contradictory; neither is attacking the other's character or parenting; both are engaging with the structural problem rather than personalizing it"
      }
    ],
    "perception_notes_log": [
      {
        "turn_index": 1,
        "notes": [
          "Turn 1: No party input has occurred yet",
          "Cannot assess psychological state without party speech or behavior",
          "Scaffold suggests 'apparently_stable' but this is assumption, not observation",
          "First substantive perception will occur after parties respond to opening frame"
        ]
      },
      {
        "turn_index": 3,
        "notes": [
          "Party A's complaint is procedural and specific, not emotionally dysregulated",
          "Party A used 'should not' language \u2014 prescriptive rather than exploratory",
          "Critical gap: we have no signal from Party B yet \u2014 their emotional state and whether they feel blamed or defensive is entirely unknown",
          "Party A's concern (timing, documentation, notice) points to underlying interests in predictability and respect, but these have not been explicitly articulated"
        ]
      },
      {
        "turn_index": 5,
        "notes": [
          "Party B's first substantive turn reveals they are not defensive about A's complaint but rather focused on preserving reciprocal fairness",
          "The tension is structural (notice/documentation vs. flexibility/autonomy) rather than interpersonal",
          "Both parties are using process language ('should not appear weeks later' vs. 'should stay workable') rather than character attacks",
          "No power imbalance signals \u2014 both parties are engaging assertively and directly"
        ]
      }
    ],
    "last_updated_turn": 5
  },
  "party_b": {
    "party_id": "party_b",
    "current_emotional_state": "mildly frustrated but constructive \u2014 responding to perceived constraint rather than escalating",
    "emotional_arc": [
      {
        "turn_index": 1,
        "assessment": "unknown_baseline",
        "confidence": "low"
      },
      {
        "turn_index": 3,
        "assessment": "unknown \u2014 has not yet spoken",
        "confidence": "moderate"
      },
      {
        "turn_index": 5,
        "assessment": "mildly frustrated but constructive \u2014 responding to perceived constraint rather than escalating",
        "confidence": "moderate"
      }
    ],
    "accumulated_interests": [
      {
        "interest": "maintaining flexibility in expense coordination",
        "first_seen_turn": 5,
        "last_seen_turn": 5,
        "confidence": "moderate"
      },
      {
        "interest": "preserving autonomy in parenting decisions",
        "first_seen_turn": 5,
        "last_seen_turn": 5,
        "confidence": "moderate"
      },
      {
        "interest": "avoiding gatekeeping dynamics in co-parenting",
        "first_seen_turn": 5,
        "last_seen_turn": 5,
        "confidence": "moderate"
      },
      {
        "interest": "ensuring legitimate expenses are honored",
        "first_seen_turn": 5,
        "last_seen_turn": 5,
        "confidence": "moderate"
      },
      {
        "interest": "not being subject to arbitrary veto power",
        "first_seen_turn": 5,
        "last_seen_turn": 5,
        "confidence": "moderate"
      }
    ],
    "risk_signal_history": [
      {
        "signal": "silence after Party A's complaint could indicate defensiveness, withdrawal, or simply awaiting invitation to speak",
        "first_seen_turn": 3,
        "last_seen_turn": 3,
        "resolved": false,
        "resolution_note": null
      }
    ],
    "relational_posture_progression": [
      {
        "turn_index": 1,
        "posture": "not_yet_observable"
      },
      {
        "turn_index": 3,
        "posture": "unknown \u2014 Party B's response to Party A's complaint will be diagnostic"
      },
      {
        "turn_index": 5,
        "posture": "engaged and boundary-asserting \u2014 naming a counter-concern about control without being defensive about A's specific complaint"
      }
    ],
    "scaffold_divergence_log": [
      {
        "turn_index": 1,
        "field": "relational_dynamic",
        "scaffold_value": "cooperative_and_stable",
        "model_value": "session_has_not_begun"
      },
      {
        "turn_index": 3,
        "field": "relational_dynamic",
        "scaffold_value": "cooperative_and_stable",
        "model_value": "asymmetric disclosure \u2014 Party A has staked out a position on process; Party B's response will reveal whether this is a shared concern, a contested issue, or a misunderstanding. No escalation signals yet, but the frame is complaint-oriented rather than interest-oriented."
      },
      {
        "turn_index": 5,
        "field": "relational_dynamic",
        "scaffold_value": "cooperative_and_stable",
        "model_value": "constructive tension \u2014 both parties have articulated legitimate process interests that are in tension but not contradictory; neither is attacking the other's character or parenting; both are engaging with the structural problem rather than personalizing it"
      }
    ],
    "perception_notes_log": [
      {
        "turn_index": 1,
        "notes": [
          "Turn 1: No party input has occurred yet",
          "Cannot assess psychological state without party speech or behavior",
          "Scaffold suggests 'apparently_stable' but this is assumption, not observation",
          "First substantive perception will occur after parties respond to opening frame"
        ]
      },
      {
        "turn_index": 3,
        "notes": [
          "Party A's complaint is procedural and specific, not emotionally dysregulated",
          "Party A used 'should not' language \u2014 prescriptive rather than exploratory",
          "Critical gap: we have no signal from Party B yet \u2014 their emotional state and whether they feel blamed or defensive is entirely unknown",
          "Party A's concern (timing, documentation, notice) points to underlying interests in predictability and respect, but these have not been explicitly articulated"
        ]
      },
      {
        "turn_index": 5,
        "notes": [